number,value,datetime_start,datetime_complete,duration,params_act,params_arch,params_batch,params_conv_blocks,params_conv_drop,params_dense,params_dropout,params_filters,params_kernel,params_l2,params_lr,params_lstm_drop,params_optim,params_pool,params_units,params_window,user_attrs_precision,user_attrs_recall,state
0,-0.45369753497668225,2025-06-11 10:39:11.902110,2025-06-11 10:39:58.633124,0 days 00:00:46.731014,elu,lstm_conv,128,2,0.05454749016213018,64,0.11649165607921677,128,5,6.847920095574779e-05,8.851384099881297e-05,0.055021352956030146,nadam,gmp,96,60,0.5409054805401112,0.4198520345252774,COMPLETE
1,-0.43552690084481993,2025-06-11 10:39:59.133123,2025-06-11 10:40:29.562578,0 days 00:00:30.429455,relu,conv_lstm,128,1,0.16401308380298388,32,0.35793094017105953,48,2,6.218704727769077e-05,0.0021787220464104273,0.05545633665765811,nadam,gmp,32,30,0.5352459016393443,0.3984136668700427,COMPLETE
2,-0.5444579780755177,2025-06-11 10:40:30.074577,2025-06-11 10:43:33.132411,0 days 00:03:03.057834,relu,lstm_conv,64,1,0.09926940745579475,128,0.25502298854208527,64,6,0.0004588156549160974,0.000345652389857876,0.01906750508580709,nadam,gmp,128,60,0.5315101070154578,0.5511713933415536,COMPLETE
3,-0.6455766047452639,2025-06-11 10:43:33.705410,2025-06-11 10:44:01.421356,0 days 00:00:27.715946,elu,lstm_conv,128,1,0.24110162306973432,32,0.3584365199693973,64,3,8.995191735587168e-06,7.846192726793281e-05,0.05597101766581075,adamw,gmp,64,66,0.5325443786982249,0.7222222222222222,COMPLETE
4,-0.015412511332728923,2025-06-11 10:44:01.954355,2025-06-11 10:44:40.118045,0 days 00:00:38.163690,relu,lstm_conv,32,1,0.2724797657899961,128,0.09682210860460017,32,3,0.00010385003379927417,0.0011304331263607352,0.07186856720009173,nadam,gap,64,30,0.5483870967741935,0.010372178157413058,COMPLETE
5,0.6921942830085754,2025-06-11 10:44:40.637044,2025-06-11 10:44:50.781024,0 days 00:00:10.143980,elu,conv_lstm,16,2,0.07738248831454668,32,0.09674091636018067,96,7,1.902428324748959e-06,0.001969497011745637,0.1979952138102537,nadam,gmp,128,42,,,PRUNED
6,0.6915355324745178,2025-06-11 10:44:51.335023,2025-06-11 10:44:58.577333,0 days 00:00:07.242310,relu,conv_lstm,16,1,0.1948898697141644,32,0.1470863212237734,128,5,6.24607368131809e-06,0.00013577521331829283,0.2547670231482534,adam,gmp,192,18,,,PRUNED
7,-0.47227658186562305,2025-06-11 10:44:59.142332,2025-06-11 10:46:15.803898,0 days 00:01:16.661566,relu,conv_lstm,32,1,0.25534100145505706,128,0.2784119186699892,32,4,5.130781383387442e-05,7.44328260046302e-05,0.0950766015468833,nadam,gap,32,72,0.5296269202633505,0.44801980198019803,COMPLETE
8,0.7174326777458191,2025-06-11 10:46:16.369897,2025-06-11 10:46:28.446873,0 days 00:00:12.076976,relu,lstm_conv,64,2,0.13967940543973803,64,0.014939275499685767,48,7,0.00029363084977630154,0.00021849597634163043,0.16279339041227298,nadam,gap,128,42,,,PRUNED
9,0.697993814945221,2025-06-11 10:46:29.035873,2025-06-11 10:46:41.988847,0 days 00:00:12.952974,elu,conv_lstm,128,2,0.16476799941183615,128,0.2951587666783074,128,7,4.6032245160252616e-05,0.0006119303790819647,0.21437877681001868,adam,gmp,32,60,,,PRUNED
10,0.7126273512840271,2025-06-11 10:46:42.579846,2025-06-11 10:46:51.064830,0 days 00:00:08.484984,elu,lstm_conv,128,2,0.2940927363730487,32,0.30602968034379896,64,5,1.8856473797675402e-06,6.155496984137775e-05,0.059848726103446395,adamw,gmp,64,66,,,PRUNED
11,0.6976842880249023,2025-06-11 10:46:51.663829,2025-06-11 10:47:02.381807,0 days 00:00:10.717978,relu,lstm_conv,64,1,0.11111837034170777,128,0.16443192095012035,64,6,5.876801977230739e-05,0.00011382074827447258,0.014226479155539425,nadam,gmp,64,72,,,PRUNED
12,0.7646193504333496,2025-06-11 10:47:02.996807,2025-06-11 10:47:15.757782,0 days 00:00:12.760975,elu,lstm_conv,32,1,0.2559922672709138,32,0.37390899455692156,64,3,0.0001594420152473817,0.0004285721309320639,0.0640601765914204,nadam,gmp,64,72,,,PRUNED
13,-0.40899653979238754,2025-06-11 10:47:16.368780,2025-06-11 10:49:59.449810,0 days 00:02:43.081030,elu,conv_lstm,16,1,0.20891480273331137,32,0.3182075971210565,32,2,1.4450834450414745e-06,0.00011034399964924584,0.0034362246656019363,adamw,gmp,64,60,0.541704857928506,0.3643649815043157,COMPLETE
14,0.7115437388420105,2025-06-11 10:50:00.053808,2025-06-11 10:50:12.665784,0 days 00:00:12.611976,relu,lstm_conv,64,1,0.1634026779982557,32,0.273130077440915,32,7,0.0002637345281867394,0.0002685694130555375,0.10382892342460467,adamw,gmp,128,48,,,PRUNED
15,-0.40077378243058714,2025-06-11 10:50:13.295783,2025-06-11 10:50:56.878322,0 days 00:00:43.582539,elu,lstm_conv,128,1,0.18781659782195845,128,0.17320599235069814,64,2,4.942630267966436e-06,5.014831949229445e-05,0.16808041453362255,adamw,gmp,64,48,0.516725352112676,0.3603437691835482,COMPLETE
16,-0.4851612903225807,2025-06-11 10:50:57.510321,2025-06-11 10:51:29.310762,0 days 00:00:31.800441,elu,conv_lstm,128,2,0.2360813150364453,32,0.3935929494311614,64,2,5.327938953170226e-06,0.00023131559528892246,0.12773539329572808,adamw,gmp,32,66,0.5333333333333333,0.4641975308641975,COMPLETE
17,0.6891883611679077,2025-06-11 10:51:29.924761,2025-06-11 10:51:34.411327,0 days 00:00:04.486566,relu,lstm_conv,64,1,0.15439816159521141,32,0.3554043718761065,64,3,3.096330816237234e-05,9.609794770838972e-05,0.010259099864181588,adamw,gmp,64,48,,,PRUNED
18,0.7069936990737915,2025-06-11 10:51:35.047326,2025-06-11 10:51:40.241316,0 days 00:00:05.193990,elu,lstm_conv,64,1,0.0772748728562796,128,0.3631854714238974,64,5,0.0001252823467010463,0.00017390056317744386,0.009461307342284543,nadam,gap,128,30,,,PRUNED
19,0.7023229598999023,2025-06-11 10:51:40.880314,2025-06-11 10:51:51.358056,0 days 00:00:10.477742,relu,lstm_conv,16,1,0.017672975489134865,128,0.2115970542736324,64,7,0.00039225809652352044,0.00203817833487036,0.04288347028836205,nadam,gmp,128,60,,,PRUNED
20,0.8063153624534607,2025-06-11 10:51:52.011056,2025-06-11 10:51:58.680042,0 days 00:00:06.668986,relu,conv_lstm,64,1,0.0533355170426924,128,0.38214923273741597,64,4,0.0008171378608919813,0.00024345827204114455,0.02101906433537764,adam,gmp,128,54,,,PRUNED
21,0.6897825002670288,2025-06-11 10:51:59.343042,2025-06-11 10:52:04.086032,0 days 00:00:04.742990,elu,conv_lstm,64,2,0.20847147234781624,128,0.34978284019778383,64,2,2.2074304992915234e-06,0.00024276667862700396,0.09945528652485466,adam,gmp,32,54,,,PRUNED
22,0.7033195495605469,2025-06-11 10:52:04.754031,2025-06-11 10:52:09.025447,0 days 00:00:04.271416,elu,conv_lstm,128,2,0.23360141255859057,32,0.25338810044194165,64,2,3.679699934515438e-05,0.0006260556071931308,0.09890509137526222,adamw,gmp,32,60,,,PRUNED
23,0.6901470422744751,2025-06-11 10:52:09.703050,2025-06-11 10:52:14.785040,0 days 00:00:05.081990,elu,lstm_conv,128,1,0.22359795505337876,32,0.343459697555215,96,2,5.849204002678381e-06,0.00010005276836858527,0.06285818081978567,adamw,gmp,64,72,,,PRUNED
24,0.7648173570632935,2025-06-11 10:52:15.495039,2025-06-11 10:52:23.863150,0 days 00:00:08.368111,relu,lstm_conv,64,1,0.07666985094716736,128,0.3501937886533361,32,7,0.000837036827582879,0.0003200584942488318,0.012750104203544398,nadam,gmp,128,72,,,PRUNED
25,0.6951412558555603,2025-06-11 10:52:24.557149,2025-06-11 10:52:34.436758,0 days 00:00:09.879609,elu,conv_lstm,16,2,0.22474970798742222,32,0.3792495590073476,96,3,2.353540901110792e-05,0.00016192603551548138,0.2547679001617765,adamw,gmp,32,66,,,PRUNED
26,0.6896439790725708,2025-06-11 10:52:35.142758,2025-06-11 10:52:41.829744,0 days 00:00:06.686986,relu,conv_lstm,128,2,0.2572242172730228,32,0.33203410989802984,128,2,1.9592986553036822e-05,7.365583487845066e-05,0.07054146410437584,adamw,gmp,128,48,,,PRUNED
27,0.689822793006897,2025-06-11 10:52:42.542743,2025-06-11 10:52:46.979352,0 days 00:00:04.436609,elu,conv_lstm,128,1,0.24433974065746455,64,0.38576794535859826,128,3,1.0066290386308108e-05,0.00011834828027285997,0.11843806779244581,adamw,gap,64,42,,,PRUNED
28,0.8275194764137268,2025-06-11 10:52:47.700351,2025-06-11 10:52:55.888170,0 days 00:00:08.187819,relu,lstm_conv,64,1,0.017122530604972777,32,0.12722950275496603,128,4,0.0006497599206928037,0.0003128669869349729,0.002346104039133188,nadam,gmp,128,60,,,PRUNED
29,-0.48534132249090534,2025-06-11 10:52:56.619170,2025-06-11 10:54:50.386017,0 days 00:01:53.766847,elu,lstm_conv,128,1,0.22754003777878917,32,0.38484877250659877,64,4,1.819285810892811e-05,8.460833518022366e-05,0.15940702946381022,nadam,gmp,96,60,0.5290412876137159,0.46609124537607893,COMPLETE
30,0.7189043760299683,2025-06-11 10:54:51.186524,2025-06-11 10:55:12.858963,0 days 00:00:21.672439,relu,lstm_conv,16,1,0.14940944993074204,32,0.24534929741864608,64,6,0.0003327475077737618,0.00016659779552776857,0.028058454708172274,nadam,gap,128,60,,,PRUNED
31,0.6890538930892944,2025-06-11 10:55:13.709963,2025-06-11 10:55:23.627542,0 days 00:00:09.917579,relu,lstm_conv,128,1,0.24954099554432171,32,0.31935550318880346,96,5,8.285418038449729e-06,0.00014730468917630295,0.1351618425265101,nadam,gmp,96,42,,,PRUNED
32,0.6892015933990479,2025-06-11 10:55:24.408542,2025-06-11 10:55:39.389821,0 days 00:00:14.981279,elu,lstm_conv,128,1,0.19698817014456924,32,0.34898470155952077,64,5,2.052861756629761e-05,0.00010570947575189881,0.13155685229492342,nadam,gmp,128,60,,,PRUNED
33,0.9116784334182739,2025-06-11 10:55:40.186819,2025-06-11 10:55:52.226922,0 days 00:00:12.040103,elu,lstm_conv,64,1,0.09780530276747396,64,0.23014975301355006,64,7,0.000841243432062564,0.00038899215844579344,0.05128325925450511,nadam,gmp,96,54,,,PRUNED
34,0.7110594511032104,2025-06-11 10:55:52.973922,2025-06-11 10:56:04.775456,0 days 00:00:11.801534,elu,lstm_conv,64,1,0.18990146909926017,32,0.3726522783765958,64,2,0.00011330489764304161,6.398884802106415e-05,0.1977456198250093,nadam,gmp,96,60,,,PRUNED
35,-0.362377655765099,2025-06-11 10:56:05.533455,2025-06-11 10:57:05.049770,0 days 00:00:59.516315,relu,lstm_conv,128,2,0.23366150950746545,128,0.35896385136125897,64,3,1.1446072678729505e-05,0.00011510839932729144,0.14648444436415492,adamw,gmp,32,66,0.5331928345626976,0.31234567901234567,COMPLETE
36,0.6905742287635803,2025-06-11 10:57:05.832768,2025-06-11 10:57:15.209739,0 days 00:00:09.376971,elu,conv_lstm,32,2,0.21785732345304668,32,0.3762129195044624,128,3,1.4520927484494516e-06,0.00029252742882734375,0.14380800563369017,adamw,gmp,64,72,,,PRUNED
37,0.6941946148872375,2025-06-11 10:57:16.011739,2025-06-11 10:57:26.170819,0 days 00:00:10.159080,elu,lstm_conv,16,1,0.2097070746880472,128,0.32874819534024186,64,5,4.116039850739703e-06,6.238826965464711e-05,0.17021122073486294,nadam,gap,96,54,,,PRUNED
38,0.6894412636756897,2025-06-11 10:57:26.993817,2025-06-11 10:57:32.217959,0 days 00:00:05.224142,relu,lstm_conv,128,1,0.27754207239029777,32,0.3857107581447717,64,3,9.734875088001747e-06,0.00030876186617299315,0.0948193427612506,adamw,gap,64,60,,,PRUNED
39,0.6881411671638489,2025-06-11 10:57:33.034135,2025-06-11 10:57:39.622419,0 days 00:00:06.588284,relu,conv_lstm,128,2,0.272055921365472,32,0.39792043249355125,64,2,9.129686576880755e-06,0.0005117326578081804,0.12338992787073857,adamw,gmp,96,60,,,PRUNED
40,0.6983159780502319,2025-06-11 10:57:40.435418,2025-06-11 10:57:48.439504,0 days 00:00:08.004086,elu,conv_lstm,128,2,0.23627472464414065,32,0.36383143437998994,96,2,1.1120924185935756e-06,0.0002810599345808861,0.18866677490784683,adam,gmp,128,60,,,PRUNED
41,0.7074617147445679,2025-06-11 10:57:49.257503,2025-06-11 10:57:55.757514,0 days 00:00:06.500011,relu,conv_lstm,32,1,0.24540432662748385,128,0.2509201649186721,64,5,0.0001981754461643541,0.00012162114289338097,0.11378273194617133,adam,gap,32,72,,,PRUNED
42,0.6927868127822876,2025-06-11 10:57:56.589512,2025-06-11 10:58:04.463184,0 days 00:00:07.873672,relu,conv_lstm,128,1,0.24107743387755542,64,0.33699170772127823,32,5,7.32703620156881e-05,7.846227353294061e-05,0.15833593014106045,nadam,gap,128,72,,,PRUNED
43,-0.43895809739524344,2025-06-11 10:58:05.307182,2025-06-11 10:59:09.543072,0 days 00:01:04.235890,relu,conv_lstm,32,1,0.2356418194697563,32,0.29961288713995005,32,4,1.662021158813203e-05,6.31533497785359e-05,0.02297373018420311,nadam,gap,32,66,0.5497872340425531,0.3987654320987654,COMPLETE
44,0.6909363269805908,2025-06-11 10:59:10.366095,2025-06-11 10:59:22.697591,0 days 00:00:12.331496,elu,conv_lstm,16,1,0.26650627537702326,32,0.3546987461663935,64,4,1.6773632791489286e-05,6.197404948288097e-05,0.08889239791399564,adamw,gmp,96,72,,,PRUNED
45,0.6912890672683716,2025-06-11 10:59:23.559590,2025-06-11 10:59:29.440578,0 days 00:00:05.880988,elu,lstm_conv,128,1,0.22778199686879944,128,0.37189575500036265,32,5,1.9941725329910935e-05,7.515096754899639e-05,0.10000258437041684,adam,gmp,96,48,,,PRUNED
46,0.6907364726066589,2025-06-11 10:59:30.294577,2025-06-11 10:59:35.998565,0 days 00:00:05.703988,relu,conv_lstm,64,1,0.2618897613369739,128,0.29272143843270754,32,4,4.1962521668466694e-05,9.85200897886322e-05,0.11879157945877312,nadam,gap,32,66,,,PRUNED
47,0.6883115768432617,2025-06-11 10:59:36.869564,2025-06-11 10:59:47.699268,0 days 00:00:10.829704,elu,conv_lstm,16,2,0.11623775217829319,32,0.3891761614421062,64,3,3.652736632665461e-06,0.000500400173948605,0.09740876382561194,nadam,gmp,32,72,,,PRUNED
48,0.6913645267486572,2025-06-11 10:59:48.586267,2025-06-11 10:59:53.402257,0 days 00:00:04.815990,relu,lstm_conv,64,1,0.09650970098983024,128,0.19961920333979147,48,5,7.524739396471147e-05,0.0004591079040149799,0.09977792516862918,nadam,gmp,32,48,,,PRUNED
49,0.6917405724525452,2025-06-11 10:59:54.295256,2025-06-11 11:00:00.516886,0 days 00:00:06.221630,elu,lstm_conv,128,1,0.20670933366434552,32,0.3860208548671159,64,4,6.417933555748062e-06,7.774091495888724e-05,0.128651167186194,adam,gap,96,54,,,PRUNED
50,0.7015992403030396,2025-06-11 11:00:01.426885,2025-06-11 11:00:09.040873,0 days 00:00:07.613988,relu,conv_lstm,32,1,0.25994537877360957,128,0.22318988027633302,32,3,0.00010950501031097206,8.697466877333926e-05,0.09583425046693816,adamw,gap,64,60,,,PRUNED
51,0.7218742966651917,2025-06-11 11:00:09.979051,2025-06-11 11:00:16.886037,0 days 00:00:06.906986,elu,lstm_conv,128,1,0.0031522481163054825,64,0.19894566271904027,128,7,0.00018839222455275812,8.35412661569685e-05,0.09664763503833379,nadam,gap,96,54,,,PRUNED
52,0.6871791481971741,2025-06-11 11:00:17.812643,2025-06-11 11:00:27.329624,0 days 00:00:09.516981,elu,lstm_conv,32,1,0.2766948344716003,32,0.37608993859683365,32,4,1.144992427164262e-05,6.023348999661568e-05,0.17294494058917756,nadam,gmp,96,72,,,PRUNED
53,0.6999440789222717,2025-06-11 11:00:28.255623,2025-06-11 11:00:32.939613,0 days 00:00:04.683990,elu,lstm_conv,128,2,0.09284320838559142,64,0.14087939099788377,128,6,6.021476774907259e-05,6.216156868401659e-05,0.09381163178516155,adamw,gmp,32,66,,,PRUNED
54,0.7000780701637268,2025-06-11 11:00:33.872612,2025-06-11 11:00:40.401598,0 days 00:00:06.528986,elu,lstm_conv,128,2,0.020494300594033343,64,0.09379321228662295,128,4,8.928943169393917e-06,8.144022141194098e-05,0.05527577003466055,nadam,gmp,96,48,,,PRUNED
55,0.6972222924232483,2025-06-11 11:00:41.337597,2025-06-11 11:00:46.184587,0 days 00:00:04.846990,elu,conv_lstm,128,2,0.22868072069376322,32,0.3782969467301751,48,3,8.413324314489452e-06,0.0002994087235398159,0.08146179430503048,adamw,gap,32,54,,,PRUNED
56,0.6891375184059143,2025-06-11 11:00:47.132594,2025-06-11 11:00:53.282202,0 days 00:00:06.149608,elu,lstm_conv,128,1,0.24215319691424603,128,0.39374026727953987,64,2,9.232555916585002e-06,5.2323335983164786e-05,0.1520458069006772,nadam,gmp,96,48,,,PRUNED
57,0.769812822341919,2025-06-11 11:00:54.233200,2025-06-11 11:01:00.427188,0 days 00:00:06.193988,elu,lstm_conv,128,2,0.07534342027976323,128,0.14858571520868447,96,5,0.00031999397676231434,0.00012417615826660022,0.0404768054498468,nadam,gmp,96,42,,,PRUNED
58,0.7060081958770752,2025-06-11 11:01:01.373187,2025-06-11 11:01:09.234171,0 days 00:00:07.860984,elu,lstm_conv,128,2,0.039725136749521585,64,0.09807829446078412,32,7,8.264221858342824e-05,0.0001608404078168374,0.11796058867671491,nadam,gmp,96,72,,,PRUNED
59,0.6949008107185364,2025-06-11 11:01:10.201169,2025-06-11 11:01:16.930574,0 days 00:00:06.729405,elu,conv_lstm,32,1,0.2630703735428676,64,0.37220576551358064,32,3,0.00012623686358142103,0.0002852300190318049,0.16821930369868798,nadam,gap,32,72,,,PRUNED
60,0.6890782117843628,2025-06-11 11:01:17.919574,2025-06-11 11:01:23.723867,0 days 00:00:05.804293,elu,conv_lstm,128,2,0.21768969574683886,32,0.38270122910988885,64,4,4.29631741020543e-06,0.00018399404042740002,0.1927583805602363,adam,gmp,32,72,,,PRUNED
61,-0.5177470775770457,2025-06-11 11:01:24.734865,2025-06-11 11:02:16.169764,0 days 00:00:51.434899,relu,conv_lstm,32,2,0.1989696381583863,32,0.36744287149341615,32,5,1.7302030711379213e-06,5.455257886876994e-05,0.005580951821487788,nadam,gap,32,66,0.5542662116040956,0.5012345679012346,COMPLETE
62,-0.5930164888457807,2025-06-11 11:02:17.151763,2025-06-11 11:03:08.188664,0 days 00:00:51.036901,elu,conv_lstm,32,2,0.21453123510575015,32,0.29101309330041714,48,6,4.408019441047806e-06,0.0002105071504526393,0.027551873429709623,nadam,gap,32,72,0.5299011960478419,0.630569306930693,COMPLETE
63,-0.2514877102199224,2025-06-11 11:03:09.170662,2025-06-11 11:03:54.005355,0 days 00:00:44.834693,elu,conv_lstm,32,2,0.2989162522589132,32,0.30333937946672546,48,6,8.372446206862358e-06,0.00025271165994944294,0.08132969197962318,nadam,gap,32,48,0.5337726523887973,0.19889502762430938,COMPLETE
64,0.6877567768096924,2025-06-11 11:03:54.992353,2025-06-11 11:04:01.244238,0 days 00:00:06.251885,relu,conv_lstm,32,2,0.18280741454929378,64,0.346997135050217,32,6,3.405693961803247e-06,7.438730806454763e-05,0.0012546699766209117,nadam,gmp,32,42,,,PRUNED
65,0.6949966549873352,2025-06-11 11:04:02.267237,2025-06-11 11:04:11.249218,0 days 00:00:08.981981,elu,conv_lstm,32,2,0.1799480586431392,32,0.23605097239382888,128,7,1.148994926924955e-05,8.755985573621002e-05,0.0672360086802247,adam,gap,32,66,,,PRUNED
66,-0.540973630831643,2025-06-11 11:04:12.279217,2025-06-11 11:05:21.107782,0 days 00:01:08.828565,relu,lstm_conv,16,2,0.23383847909059918,32,0.3575805375016528,32,6,2.6996946846348575e-06,6.162401599939389e-05,0.030633721766361807,nadam,gap,32,72,0.5235571260306242,0.5501237623762376,COMPLETE
67,-0.0610079575596817,2025-06-11 11:05:22.144780,2025-06-11 11:06:38.265876,0 days 00:01:16.121096,relu,lstm_conv,16,2,0.19022447704338202,128,0.3050848117604642,32,5,2.7209759338291484e-06,0.00020821023998489688,0.024019830142971068,nadam,gap,32,66,0.45098039215686275,0.04259259259259259,COMPLETE
68,-0.6261647409616101,2025-06-11 11:06:39.291873,2025-06-11 11:07:09.482814,0 days 00:00:30.190941,relu,conv_lstm,128,2,0.15816703780343883,32,0.33150094218723614,64,5,1.956131238880811e-06,5.535662736619143e-05,0.036691497101639006,nadam,gap,32,60,0.527803958529689,0.6905055487053021,COMPLETE
69,-0.3591954022988506,2025-06-11 11:07:10.540812,2025-06-11 11:07:36.689489,0 days 00:00:26.148677,relu,conv_lstm,128,2,0.1679617823714246,32,0.3323804807913687,64,5,4.864634166023898e-06,8.962302805364637e-05,0.057380590266690276,nadam,gap,32,54,0.5399568034557235,0.3076923076923077,COMPLETE
70,0.6894820332527161,2025-06-11 11:07:37.726487,2025-06-11 11:07:45.616471,0 days 00:00:07.889984,relu,lstm_conv,16,2,0.20528724088843256,32,0.3316153159103989,32,6,3.348329607782205e-05,6.900957714613557e-05,0.045128499699127966,adam,gap,32,54,,,PRUNED
71,-0.021068702290076336,2025-06-11 11:07:46.672469,2025-06-11 11:09:04.912428,0 days 00:01:18.239959,relu,lstm_conv,16,1,0.21622983789804665,32,0.281709666941495,96,7,1.739885760568174e-06,5.150094500038738e-05,0.020172242632605118,nadam,gap,32,66,0.6571428571428571,0.014197530864197531,COMPLETE
72,-0.43362241494329556,2025-06-11 11:09:05.962426,2025-06-11 11:10:03.940463,0 days 00:00:57.978037,elu,lstm_conv,64,2,0.24092963853770824,32,0.379686020877689,32,4,4.331290678733447e-06,7.25532848081929e-05,0.09525394718625531,nadam,gap,32,66,0.5171042163882259,0.4012345679012346,COMPLETE
73,0.6936233639717102,2025-06-11 11:10:05.001460,2025-06-11 11:10:09.514067,0 days 00:00:04.512607,elu,lstm_conv,128,1,0.23580767655827037,32,0.32073157679077346,64,3,4.0898110221002864e-05,0.00015228197652203567,0.011209125148382175,adamw,gmp,32,48,,,PRUNED
74,-0.4862267777065984,2025-06-11 11:10:10.588588,2025-06-11 11:10:58.729201,0 days 00:00:48.140613,elu,conv_lstm,32,2,0.07782538410945988,32,0.29769958245559236,48,5,3.160746290040468e-06,0.00018758089488183217,0.009970681104640902,nadam,gap,32,60,0.527449617790132,0.467940813810111,COMPLETE
75,-0.3741109530583215,2025-06-11 11:10:59.807225,2025-06-11 11:13:29.661984,0 days 00:02:29.854759,relu,conv_lstm,32,2,0.2179113236067432,32,0.39173390761526194,32,5,1.0959897476499573e-06,8.300831368763483e-05,0.1452210678795526,nadam,gap,32,54,0.5433884297520661,0.32369230769230767,COMPLETE
76,0.7028658986091614,2025-06-11 11:13:30.729983,2025-06-11 11:13:42.728958,0 days 00:00:11.998975,elu,conv_lstm,32,2,0.07116880888924312,32,0.3158597269464352,48,6,1.1934503656106323e-05,0.00019513725771861217,0.0057968475255189365,nadam,gmp,32,54,,,PRUNED
77,0.6989472508430481,2025-06-11 11:13:43.902957,2025-06-11 11:14:01.371240,0 days 00:00:17.468283,elu,lstm_conv,16,2,0.20282367532911766,32,0.3370884664678884,128,6,1.426226495066472e-05,0.00020170061401586994,0.0010479338216281588,nadam,gap,32,72,,,PRUNED
78,0.6872142553329468,2025-06-11 11:14:02.564277,2025-06-11 11:14:14.498356,0 days 00:00:11.934079,elu,conv_lstm,32,2,0.06626385964363249,32,0.23302079575621115,32,5,1.950410648915706e-06,0.0001791196339513265,0.0018236748917756906,nadam,gap,32,60,,,PRUNED
