number,value,datetime_start,datetime_complete,duration,params_act,params_arch,params_batch,params_conv_blocks,params_conv_drop,params_dense,params_dropout,params_filters,params_kernel,params_l2,params_lr,params_lstm_drop,params_optim,params_pool,params_units,params_window,user_attrs_precision,user_attrs_recall,state
79,0.701996386051178,2025-06-11 11:14:15.649354,2025-06-11 11:14:25.385335,0 days 00:00:09.735981,elu,conv_lstm,64,2,0.13074933473101233,32,0.2917112896344065,48,5,2.0948605201429156e-06,0.0001700226975301006,0.006736818679333427,adam,gap,32,48,,,PRUNED
80,0.7062365412712097,2025-06-11 11:14:26.525332,2025-06-11 11:14:41.618759,0 days 00:00:15.093427,elu,lstm_conv,32,1,0.22146081774037651,32,0.36931297822288794,64,4,2.459347141919457e-05,0.00011136979981260507,0.07498447851632437,adamw,gmp,64,66,,,PRUNED
81,0.7209652066230774,2025-06-11 11:14:42.819757,2025-06-11 11:14:58.538444,0 days 00:00:15.718687,relu,lstm_conv,64,1,0.1510859506732667,128,0.2786991441721719,64,5,0.0002841280095799042,0.0008455901235246494,0.0782465047729762,nadam,gmp,128,42,,,PRUNED
82,0.6868050694465637,2025-06-11 11:14:59.684442,2025-06-11 11:15:16.350409,0 days 00:00:16.665967,relu,lstm_conv,16,2,0.2648732961882399,32,0.26835590344525506,32,5,2.9765179263120484e-06,6.638852632061533e-05,0.115654539106849,nadam,gmp,32,72,,,PRUNED
83,-0.4446428571428572,2025-06-11 11:15:17.531407,2025-06-11 11:21:42.238200,0 days 00:06:24.706793,relu,lstm_conv,16,2,0.179595052269238,32,0.3632927424631055,32,7,1.8496041764425529e-06,7.581231192127083e-05,0.046878485675296,nadam,gap,64,72,0.532051282051282,0.41089108910891087,COMPLETE
84,-0.4152033271719039,2025-06-11 11:21:43.473196,2025-06-11 11:24:29.158965,0 days 00:02:45.685769,relu,conv_lstm,128,2,0.23493673743283072,128,0.3562251751386496,96,4,1.9270413377719823e-06,8.557261609155699e-05,0.07409827337229072,nadam,gmp,32,72,0.5465328467153284,0.37066831683168316,COMPLETE
85,-0.5739027750442826,2025-06-11 11:24:30.287963,2025-06-11 11:26:11.893365,0 days 00:01:41.605402,elu,conv_lstm,32,2,0.1671230040634918,32,0.24776914872211495,48,7,1.9929388871711597e-06,8.827523495554962e-05,0.01035073754602173,nadam,gap,32,72,0.5256895619253651,0.6014851485148515,COMPLETE
86,0.6871905326843262,2025-06-11 11:26:13.025963,2025-06-11 11:26:29.617815,0 days 00:00:16.591852,relu,conv_lstm,32,2,0.21806599878776642,32,0.30184409624266206,96,6,3.273599767003239e-06,5.028564772321862e-05,0.0055525749538403715,adamw,gap,32,72,,,PRUNED
87,0.686526358127594,2025-06-11 11:26:30.841813,2025-06-11 11:26:43.179952,0 days 00:00:12.338139,elu,conv_lstm,32,2,0.14292121913853556,64,0.3218045490224194,48,6,3.23706275472991e-06,7.723812357589083e-05,0.019754686139292484,adamw,gap,32,60,,,PRUNED
88,-0.3104738154613466,2025-06-11 11:26:44.346950,2025-06-11 11:29:56.584522,0 days 00:03:12.237572,relu,conv_lstm,32,2,0.1292360517804213,32,0.3632546848559749,128,4,3.418030717817657e-06,5.1875679069632774e-05,0.007518260501747867,nadam,gap,96,54,0.5460526315789473,0.2553846153846154,COMPLETE
89,0.689178466796875,2025-06-11 11:29:57.807520,2025-06-11 11:30:18.458479,0 days 00:00:20.650959,elu,conv_lstm,32,2,0.13658645527287855,32,0.3889557951633565,48,6,5.054636055165079e-06,9.611462738687416e-05,0.01435010308703303,nadam,gap,96,72,,,PRUNED
90,0.6866767406463623,2025-06-11 11:30:19.680477,2025-06-11 11:30:34.902449,0 days 00:00:15.221972,relu,lstm_conv,128,1,0.20535601738559173,32,0.37010248257601425,64,3,1.7310912178883706e-05,0.00022876510610153692,0.15141558058285193,nadam,gmp,96,66,,,PRUNED
91,0.6867517232894897,2025-06-11 11:30:36.119446,2025-06-11 11:30:54.872409,0 days 00:00:18.752963,relu,conv_lstm,16,2,0.17376790373557305,32,0.27492039396776596,48,7,1.9655268092216196e-06,0.0002203830806530372,0.03924015437399718,nadam,gap,32,66,,,PRUNED
92,-0.5142314990512333,2025-06-11 11:30:56.133406,2025-06-11 11:32:28.822776,0 days 00:01:32.689370,elu,conv_lstm,32,2,0.20045353387145282,32,0.04649628903486172,48,5,3.1234114249203614e-06,5.0000536347516695e-05,0.07789582358604598,nadam,gap,32,54,0.5445411922304085,0.5003076923076923,COMPLETE
93,0.7687446475028992,2025-06-11 11:32:30.036773,2025-06-11 11:32:45.544742,0 days 00:00:15.507969,relu,lstm_conv,128,1,0.10617760758950283,128,0.2916168421241599,64,7,0.0004668962746461671,5.0294286346717886e-05,0.040431975226544806,nadam,gmp,128,48,,,PRUNED
94,0.6906815767288208,2025-06-11 11:32:46.801740,2025-06-11 11:33:15.541684,0 days 00:00:28.739944,elu,conv_lstm,32,2,0.17159785235766045,32,0.07817906277946668,48,4,1.6104393103712976e-05,5.148985174102934e-05,0.12471925802431072,nadam,gap,192,54,,,PRUNED
95,0.6962503790855408,2025-06-11 11:33:16.811705,2025-06-11 11:33:29.628657,0 days 00:00:12.816952,elu,conv_lstm,16,2,0.23013778732036339,32,0.05091194067777763,128,5,8.073027697313637e-06,6.337655657327107e-05,0.11165138523998988,nadam,gap,32,54,,,PRUNED
96,0.6904482245445251,2025-06-11 11:33:30.914655,2025-06-11 11:33:37.134642,0 days 00:00:06.219987,elu,conv_lstm,32,1,0.21427770291416903,32,0.07860316893689669,48,5,1.0706410576495325e-06,9.510382354875572e-05,0.04124230867140591,nadam,gap,32,36,,,PRUNED
97,-0.41445126107702795,2025-06-11 11:33:38.411640,2025-06-11 11:34:24.449610,0 days 00:00:46.037970,elu,lstm_conv,32,2,0.21261520659116379,32,0.2655526761274365,48,6,3.7025561374641575e-06,6.240981276045473e-05,0.0537679505904001,nadam,gap,32,72,0.5201026518391788,0.37623762376237624,COMPLETE
98,0.7964645624160767,2025-06-11 11:34:25.729608,2025-06-11 11:34:38.081720,0 days 00:00:12.352112,relu,lstm_conv,64,1,0.07570741135385174,128,0.09283077257601552,64,6,0.0006369307644625351,0.00022769751291358442,0.03364260835360095,nadam,gmp,128,60,,,PRUNED
99,-0.4669873196327066,2025-06-11 11:34:39.407718,2025-06-11 11:35:09.476527,0 days 00:00:30.068809,elu,conv_lstm,128,2,0.13295312937210832,32,0.06601970937478079,48,5,2.1988908676391514e-06,0.00014826017368958116,0.09294754498505187,nadam,gap,32,54,0.5377643504531722,0.43815384615384617,COMPLETE
